[
    {
        "code": "SC-Hall des sciences",
        "nom": "Hall d'accueil",
        "capacite": "",
        "examen": "",
        "categorie": "hall",
        "reserve": "",
        "observation": "",
        "accessibilite": "",
        "batiment": "G"
    },
    {
        "code": "SC-Hall des Minimes",
        "nom": "Hall des Minimes",
        "capacite": "",
        "examen": "",
        "categorie": "hall",
        "reserve": "",
        "observation": "",
        "accessibilite": "",
        "batiment": "Minimes"
    },
    {
        "code": "SC-Amphi Baudelocque - 429 max",
        "nom": "Amphi Baudelocque",
        "capacite": "429",
        "examen": "111",
        "categorie": "amphi",
        "reserve": "",
        "observation": "",
        "accessibilite": "",
        "batiment": "I"
    },
    {
        "code": "SC-Amphi Cassini - 100 max",
        "nom": "Amphi Cassini",
        "capacite": "100",
        "examen": "28",
        "categorie": "amphi",
        "reserve": "",
        "observation": "",
        "accessibilite": "",
        "batiment": "Minimes"
    },
    {
        "code": "SC-Amphi Ehresmann - 210 max",
        "nom": "Amphi Ehresmann",
        "capacite": "210",
        "examen": "63",
        "categorie": "amphi",
        "reserve": "",
        "observation": "",
        "accessibilite": "Appareil pour sourd & muet",
        "batiment": "E"
    },
    {
        "code": "SC-Amphi Figlarz - 160 max",
        "nom": "Amphi Figlarz",
        "capacite": "160",
        "examen": "41",
        "categorie": "amphi",
        "reserve": "",
        "observation": "1er étage",
        "accessibilite": "",
        "batiment": "Minimes"
    },
    {
        "code": "SC-Amphi Hauy - 439 max",
        "nom": "Amphi Hauy",
        "capacite": "439",
        "examen": "118",
        "categorie": "amphi",
        "reserve": "",
        "observation": "",
        "accessibilite": "",
        "batiment": "F"
    },
    {
        "code": "SC-Amphi Lavoisier - 210 max",
        "nom": "Amphi Lavoisier",
        "capacite": "210",
        "examen": "63",
        "categorie": "amphi",
        "reserve": "",
        "observation": "",
        "accessibilite": "",
        "batiment": "E"
    },
    {
        "code": "SC-Amphi Méchain - 50 max",
        "nom": "Amphi Méchain",
        "capacite": "50",
        "examen": "15",
        "categorie": "amphi",
        "reserve": "",
        "observation": "1er étage",
        "accessibilite": "non accessible personnes en fauteuil",
        "batiment": "Minimes"
    },
    {
        "code": "SC-Amphi Parmentier - 210 max",
        "nom": "Amphi Parmentier",
        "capacite": "210",
        "examen": "63",
        "categorie": "amphi",
        "reserve": "",
        "observation": "",
        "accessibilite": "",
        "batiment": "E"
    },
    {
        "code": "SC-Amphi Peltier - 100 max",
        "nom": "Amphi Peltier",
        "capacite": "100",
        "examen": "28",
        "categorie": "amphi",
        "reserve": "",
        "observation": "",
        "accessibilite": "",
        "batiment": "Minimes"
    },
    {
        "code": "SC-B010 - 18 max (Info)",
        "nom": "B010",
        "capacite": "18 / 20",
        "examen": "",
        "categorie": "salle informatique",
        "reserve": "",
        "observation": "accessible aux étudiants",
        "accessibilite": "",
        "batiment": "B"
    },
    {
        "code": "SC-TP B204 - 14 max",
        "nom": "TP B204",
        "capacite": "20 / 18",
        "examen": "",
        "categorie": "salle informatique",
        "reserve": "Départ. physique",
        "observation": "",
        "accessibilite": "",
        "batiment": "B"
    },
    {
        "code": "SC-B205 - 14 max",
        "nom": "B205",
        "capacite": "16",
        "examen": "",
        "categorie": "salle banalisée",
        "reserve": "Départ. physique",
        "observation": "vérifiée le 02/07/26",
        "accessibilite": "",
        "batiment": "B"
    },
    {
        "code": "SC-B206 - 26 max",
        "nom": "B206",
        "capacite": "26",
        "examen": "",
        "categorie": "salle banalisée",
        "reserve": "Départ. physique",
        "observation": "vérifiée le 02/07/26",
        "accessibilite": "",
        "batiment": "B"
    },
    {
        "code": "SC-BC02 - 88 max",
        "nom": "BC02",
        "capacite": "88",
        "examen": "44",
        "categorie": "salle banalisée",
        "reserve": "",
        "observation": "vérifiée le 19/10/25",
        "accessibilite": "",
        "batiment": "BC"
    },
    {
        "code": "SC-BC21 - 44 max",
        "nom": "BC21",
        "capacite": "44",
        "examen": "⚠ 34",
        "categorie": "salle de TD modulable en ilot",
        "reserve": "",
        "observation": "",
        "accessibilite": "",
        "batiment": "BC"
    },
    {
        "code": "SC-BC21bis - 7 max",
        "nom": "BC21bis",
        "capacite": "12",
        "examen": "4",
        "categorie": "autre",
        "reserve": "",
        "observation": "Interclasse, vérifiée le 02/07/27",
        "accessibilite": "",
        "batiment": "BC"
    },
    {
        "code": "SC-BC22 - 90 max",
        "nom": "BC22",
        "capacite": "90",
        "examen": "44",
        "categorie": "salle banalisée",
        "reserve": "",
        "observation": "",
        "accessibilite": "",
        "batiment": "BC"
    },
    {
        "code": "SC-BC31 - 80 max",
        "nom": "BC31",
        "capacite": "82",
        "examen": "41",
        "categorie": "salle banalisée",
        "reserve": "",
        "observation": "vérifiée le 19/10/25",
        "accessibilite": "",
        "batiment": "BC"
    },
    {
        "code": "SC-BC31bis - 7 max",
        "nom": "BC31bis",
        "capacite": "7",
        "examen": "3",
        "categorie": "autre",
        "reserve": "",
        "observation": "Bureau de Mme ABDELLAOUI",
        "accessibilite": "",
        "batiment": "BC"
    },
    {
        "code": "SC-BC32 - 90 max",
        "nom": "BC32",
        "capacite": "92",
        "examen": "46",
        "categorie": "salle banalisée",
        "reserve": "",
        "observation": "vérifiée le 19/10/25",
        "accessibilite": "",
        "batiment": "BC"
    },
    {
        "code": "SC-BC41 - 80 max",
        "nom": "BC41",
        "capacite": "80",
        "examen": "40",
        "categorie": "salle banalisée",
        "reserve": "",
        "observation": "",
        "accessibilite": "",
        "batiment": "BC"
    },
    {
        "code": "SC-BC41bis - 7 max",
        "nom": "BC41bis",
        "capacite": "13",
        "examen": "4",
        "categorie": "autre",
        "reserve": "",
        "observation": "Interclasse, vérifiée le 02/07/27",
        "accessibilite": "",
        "batiment": "BC"
    },
    {
        "code": "SC-BC42 - 90 max",
        "nom": "BC42",
        "capacite": "90",
        "examen": "44",
        "categorie": "salle banalisée",
        "reserve": "",
        "observation": "",
        "accessibilite": "",
        "batiment": "BC"
    },
    {
        "code": "SC-201- salle de réunion - 20 max",
        "nom": "CURI 201 Ada Lovelace",
        "capacite": "20",
        "examen": "",
        "categorie": "salle de réunion",
        "reserve": "",
        "observation": "",
        "accessibilite": "",
        "batiment": "CURI"
    },
    {
        "code": "SC-salle TP 304 - 16 max",
        "nom": "CURI 304",
        "capacite": "16",
        "examen": "",
        "categorie": "salle de TP",
        "reserve": "",
        "observation": "Contrôle d'accès",
        "accessibilite": "",
        "batiment": "CURI"
    },
    {
        "code": "SC-salle TP 305 - 38 max",
        "nom": "CURI 305",
        "capacite": "38",
        "examen": "",
        "categorie": "salle de TP",
        "reserve": "",
        "observation": "Contrôle d'accès",
        "accessibilite": "",
        "batiment": "CURI"
    },
    {
        "code": "SC-salle TP 306 - 20 max",
        "nom": "CURI 306",
        "capacite": "20",
        "examen": "",
        "categorie": "salle de TP",
        "reserve": "",
        "observation": "Contrôle d'accès",
        "accessibilite": "",
        "batiment": "CURI"
    },
    {
        "code": "SC-S8 - 46 max",
        "nom": "CURI 8",
        "capacite": "46",
        "examen": "",
        "categorie": "salle banalisée",
        "reserve": "DISI",
        "observation": "contrôle d'accès",
        "accessibilite": "",
        "batiment": "CURI"
    },
    {
        "code": "SC-D01 - (45) 40 max (Info)",
        "nom": "D01",
        "capacite": "40 / 20",
        "examen": "",
        "categorie": "salle informatique",
        "reserve": "",
        "observation": "",
        "accessibilite": "",
        "batiment": "D"
    },
    {
        "code": "SC-D02 - 44 max (Info)",
        "nom": "D02",
        "capacite": "44 / 22",
        "examen": "",
        "categorie": "salle informatique",
        "reserve": "master info",
        "observation": "",
        "accessibilite": "",
        "batiment": "D"
    },
    {
        "code": "SC-D03 - 26 max (info)",
        "nom": "D03",
        "capacite": "26 / 13",
        "examen": "",
        "categorie": "salle informatique",
        "reserve": "",
        "observation": "Pas de VP",
        "accessibilite": "",
        "batiment": "D"
    },
    {
        "code": "SC-D11-D12 - 42 (max)",
        "nom": "D11-D12",
        "capacite": "42 / 21",
        "examen": "",
        "categorie": "salle informatique",
        "reserve": "",
        "observation": "",
        "accessibilite": "Ascenseur (2024)",
        "batiment": "D"
    },
    {
        "code": "SC-D13 - 36 (max)",
        "nom": "D13",
        "capacite": "36 / 18",
        "examen": "",
        "categorie": "salle informatique",
        "reserve": "",
        "observation": "",
        "accessibilite": "Ascenseur (2024)",